file,text_cleaned,text_lemm,text_stem,field
2018-70320-18," Система  автоматизированная  информационно-измерительная  коммерческого  учета электроэнергии (АИИС КУЭ) ЕНЭС ПС 500 кВ «Ново-Анжерская» ВЛ 110 кВ Ново-Анжерская - Троицкая I цепь, ВЛ 110 кВ Ново-Анжерская - Троицкая II цепь (далее по тексту - АИИС КУЭ) предназначена  для  измерения  активной  и  реактивной  электроэнергии,  сбора,  обработки, хранения и передачи полученной информации. Полученные  данные  и  результаты  измерений  могут  использоваться  для  оперативного управления энергопотреблением на ПС 500 кВ «Ново-Анжерская» ПАО «ФСК ЕЭС». ",система автоматизировать информационно измерительный коммерческий учёт электроэнергия аиис куэ енэс пс кв ново анжерский вл кв ново анжерский [UNK] цепь вл кв ново анжерский [UNK] цепь далее по текст аиис куэ предназначить для измерение активный и реактивный электроэнергия сбор обработка хранение и передача получить информация получить данные и результат измерение мочь использоваться для оперативный управление энергопотребление на пс кв ново анжерский пао фск еэс,систем автоматизирова информацион измерительн коммерческ учет электроэнерг аиис куэ енэс пс кв нов анжерск вл кв нов анжерск троицк цеп вл кв нов анжерск троицк цеп дал по текст аиис куэ предназнач для измерен активн и реактивн электроэнерг сбор обработк хранен и передач получен информац получен дан и результат измерен могут использова для оперативн управлен энергопотреблен на пс кв нов анжерск па фск еэс,коммерческий учет электроэнергии 2
2018-70357-18," Счетчики  холодной  и  горячей  воды  турбинные  «Смарт  Митер»  (далее  счетчики)  предназначены  для  измерений  объёма  холодной  питьевой  по  СанПиН 2.1.4.1074-01  и  сетевой воды  по  СНиП 41-02-2003,  протекающей  в  подающих  или  обратных  трубопроводах  закрытых  и  открытых  систем  теплоснабжения,  системах  холодного  и  горячего  водоснабжения  в  жилых домах, а также в других промышленных зданиях. ",счётчик холодный и горячий вода турбинный [UNK] [UNK] далее счётчик предназначить для измерение объ ма холодный питьевой по санпин и сетевой вода по снип протекать в [UNK] или обратный трубопровод закрыть и открытый система теплоснабжение система холодный и горячий водоснабжение в жилой дом а также в других промышленный здание,счетчик холодн и горяч вод турбин [UNK] [UNK] дал счетчик предназнач для измерен об ма холодн питьев по санпин и сетев вод по снип протека в [UNK] ил обратн трубопровод закрыт и открыт сист теплоснабжен систем холодн и горяч водоснабжен в жил дом а такж в друг промышлен здан,теплосчетчики для воды
2018-70422-18," Мерники  металлические  технические 1- го  класса  ММВ,  ММГ  предназначены  для измерений объема спирта, водно-спиртовых растворов и других неагрессивных жидкостей. ",[UNK] металлический технический го класс [UNK] [UNK] предназначить для измерение объём [UNK] [UNK] [UNK] раствор и других неагрессивный жидкость,[UNK] металлическ техническ го класс [UNK] [UNK] предназнач для измерен объем [UNK] водн [UNK] раствор и друг неагрессивн жидкост,
2018-70444-18," Автоцистерна АЦ-9,1, является транспортной мерой полной вместимости и предназначен для  транспортирования  и  кратковременного  хранения  нефтепродуктов  плотностью  от 700  до 860 кг/м3. ",[UNK] [UNK] являться транспортный мера полный [UNK] и предназначить для транспортирование и кратковременный хранение нефтепродукт плотность от до [UNK] м,[UNK] [UNK] явля транспортн мер полн [UNK] и предназнач для транспортирован и кратковремен хранен нефтепродукт плотност от до [UNK] м,
2018-70578-18, Трансформаторы  тока  измерительные SATEC HACS  ( далее - трансформаторы SATEC HACS)  предназначены  для  формирования  измерительного  сигнала  о  значении  силы  тока  в силовой цепи переменного тока.  ,трансформатор ток измерительный далее трансформатор предназначить для формирование измерительный сигнал о значение сила ток в силовой цепь переменный ток,трансформатор ток измерительн дал трансформатор предназнач для формирован измерительн сигна о значен сил ток в силов цеп перемен ток,трансформаторы
2018-70580-18," Система  измерительная  АСУТП  коммерческого  учета  ШФЛУ тит. 074/1 АО «ТАНЕКО»  (далее -  ИС)  предназначена  для  измерений  параметров  технологического процесса в реальном масштабе времени (давления, температуры, массового расхода). ",система измерительный асутп коммерческий учёт [UNK] [UNK] ао [UNK] далее ис предназначить для измерение параметр технологический процесс в реальный масштаб время давление температура массовый расход,систем измерительн асутп коммерческ учет [UNK] [UNK] а [UNK] дал ис предназнач для измерен параметр технологическ процесс в реальн масштаб времен давлен температур массов расход,
2018-70677-18, Система  измерений  количества  и  показателей  качества  нефти  на  УПН-1  (цех  № 2). Возврат нефти с установки (далее -  СИКН) предназначена для автоматизированных измерений массы и показателей качества нефти. ,система измерение количество и показатель качество нефть на [UNK] цех [UNK] нефть с установка далее сикн предназначить для автоматизированный измерение масса и показатель качество нефть,систем измерен количеств и показател качеств нефт на [UNK] цех [UNK] нефт с установк дал сикн предназнач для автоматизирова измерен масс и показател качеств нефт,качество и масса нефти
2018-70742-18," Шаблоны сварщика универсальные УШС-3 (далее по тексту -  шаблоны) предназначены для  измерений  глубины  дефекта  шва,  высоты  усиления  стыкового  шва,  высоты  притупления, ширины  шва,  углов  разделки,  зазора  между  свариваемыми  деталями;  для  контроля  ширины пазов, определения диаметра электродов.  ",шаблон [UNK] универсальный [UNK] далее по текст шаблон предназначить для измерение глубина дефект шов высота [UNK] [UNK] шов высота [UNK] ширина шов угол [UNK] [UNK] между [UNK] деталь для контроль ширина [UNK] определение диаметр электрод,шаблон [UNK] универсальн [UNK] дал по текст шаблон предназнач для измерен глубин дефект шва высот усилен [UNK] шва высот [UNK] ширин шва угл [UNK] [UNK] межд [UNK] детал для контрол ширин [UNK] определен диаметр электрод,
2018-70757-18," Измерители  статических  и  динамических  параметров  микросхем  КВК.  ДИЦ.  Э-16-001 (далее -  измерители)  предназначены  для  контроля  и  измерений  статических  (уровней выходного  напряжения,  выходных  токов,  токов  потребления,  токов  утечек,  входных  токов  по ГОСТ 18683.2-83)  и  динамических  (времени  задержки  распространения  сигнала,  время переключения  при  задании  управляющих  сигналов,  время  перехода  в  высокоимпедансное состояние  и  обратно  по  ГОСТ 18683.2-83)  параметров  интегральных  микросхем  в  условиях серийного  и  массового  производства  на  межоперационном  и  выходном  контроле  приборов  в корпусах и на пластинах при ручной и автоматической загрузке и выгрузке. ",измерители статический и динамический параметр [UNK] [UNK] [UNK] э далее измеритель предназначить для контроль и измерение статический уровень выходной напряжение выходной ток ток потребление ток [UNK] входной ток по гост и динамический время [UNK] [UNK] сигнал время [UNK] при [UNK] управлять сигнал время [UNK] в [UNK] состояние и [UNK] по гост параметр интегральный [UNK] в условие [UNK] и массовый производство на [UNK] и выходной контроль прибор в корпус и на [UNK] при ручной и автоматический [UNK] и [UNK],измерител статическ и динамическ параметр [UNK] [UNK] [UNK] э дал измерител предназнач для контрол и измерен статическ уровн выходн напряжен выходн ток ток потреблен ток [UNK] входн ток по гост и динамическ времен [UNK] [UNK] сигна врем [UNK] при [UNK] управля сигнал врем [UNK] в [UNK] состоян и обратн по гост параметр интегральн [UNK] в услов [UNK] и массов производств на [UNK] и выходн контрол прибор в корпус и на [UNK] при ручн и автоматическ [UNK] и [UNK],
2018-70777-18, Система  измерений  количества  и  показателей  качества  нефти  на  УСН-4/1  (цех  № 1). Возврат нефти с установки (далее -  СИКН) предназначена для автоматизированных измерений массы и показателей качества нефти. ,система измерение количество и показатель качество нефть на [UNK] цех [UNK] нефть с установка далее сикн предназначить для автоматизированный измерение масса и показатель качество нефть,систем измерен количеств и показател качеств нефт на [UNK] цех [UNK] нефт с установк дал сикн предназнач для автоматизирова измерен масс и показател качеств нефт,качество и масса нефти
2018-70843-18," Уровнемеры  импульсные  радарные Pulsar R86  и Pulsar R96  ( далее -  уровнемеры) предназначены для измерений уровня жидких сред и вычисление объёма в различных отраслях промышленности, в том числе и во взрывоопасных зонах. ",уровнемер импульсный [UNK] и далее уровнемер предназначить для измерение уровень жидкий среда и вычисление объ ма в различный отрасль промышленность в тот число и во взрывоопасный зона,уровнемер импульсн [UNK] и дал уровнемер предназнач для измерен уровн жидк сред и вычислен об ма в различн отрасл промышлен в том числ и во взрывоопасн зон,
2018-71001-18," Резервуары  стальные  вертикальные  цилиндрические  РВС-20000  предназначены  для измерения объема при приеме, хранении и отпуске нефти и нефтепродуктов. ",резервуар стальной вертикальный цилиндрический рвс предназначить для измерение объём при приём хранении и отпуск нефть и нефтепродукт,резервуар стальн вертикальн цилиндрическ рвс предназнач для измерен объем при прием хранен и отпуск нефт и нефтепродукт,резервуары для нефти
2018-71099-18," Резервуары  стальные  вертикальные  цилиндрические  РВС-3000  (далее -  резервуары) предназначены  для  измерения  объёма  сырого  рассола,  а  также  для  его  приема,  хранения  и отпуска.  ",резервуар стальной вертикальный цилиндрический рвс далее резервуар предназначить для измерение объ ма сырой [UNK] а также для его приём хранение и отпуск,резервуар стальн вертикальн цилиндрическ рвс дал резервуар предназнач для измерен об ма сыр [UNK] а такж для ег прием хранен и отпуск,резервуары для нефти
2018-71127-18," Резервуар  стальной  вертикальный  цилиндрический  РВС-2000  предназначен  для измерений объёма нефти и нефтепродуктов, а также для их приема, хранения и отпуска. ",резервуар стальной вертикальный цилиндрический рвс предназначить для измерение объ ма нефть и нефтепродукт а также для их приём хранение и отпуск,резервуар стальн вертикальн цилиндрическ рвс предназнач для измерен об ма нефт и нефтепродукт а такж для их прием хранен и отпуск,резервуары для нефти
2018-71151-18, Система  измерительная  массового  расхода  и  массы  бензина  газового  стабильного (БГС)  цеха  № 07  ЗБ  ОАО «ТАИФ-НК»  (далее  -  ИС)  предназначена  для  измерений  массового расхода (массы) бензина газового стабильного (далее - бензин). ,система измерительный массовый расход и масса бензин газовый [UNK] [UNK] цех зб оао таиф нк далее ис предназначить для измерение массовый расход масса бензин газовый [UNK] далее бензин,систем измерительн массов расход и масс бензин газов стабильн [UNK] цех зб оа таиф нк дал ис предназнач для измерен массов расход масс бензин газов стабильн дал бензин,
2018-71222-18, Твердомеры  Бринелля  EASY  3000  (далее  -  твердомеры)  предназначены  для  измерений твердости металлов и сплавов по шкалам Бринелля в соответствии с ГОСТ 9012-59. ,твердомер бринелля далее твердомер предназначить для измерение твёрдость металл и сплав по шкалам бринелля в соответствие с гост,твердомер бринелл дал твердомер предназнач для измерен твердост металл и сплав по шкал бринелл в соответств с гост,твердомеры
2018-71223-18," Барьеры  изолирующие  серий  AMG1000,  AM1000,  AM2000  (далее  -  барьеры) предназначены  для  преобразований измерительных  и  управляющих электрических  сигналов и физических  величин  (силы  и  напряжения  постоянного  тока,  электрического  сопротивления постоянному  току  и  частоты  импульсов  электрического  напряжения),  поступающих  от измерительных  преобразователей,  управляющих  устройств,  других  источников  сигналов  и передачи  изолированных  сигналов  из  одной  части  измерительного  канала  (далее  -  ИК)  или управляющего канала (далее - УК) в другую. ",барьер [UNK] серия далее барьер предназначить для преобразование измерительный и управлять электрический сигнал и физический величина сила и напряжение постоянный ток электрический сопротивление постоянный ток и частота импульс электрический напряжение поступать от измерительный преобразователь управлять устройство других источник сигнал и передача [UNK] сигнал из один часть измерительный канал далее ик или [UNK] канал далее ук в [UNK],барьер [UNK] сер дал барьер предназнач для преобразован измерительн и управля электрическ сигнал и физическ величин сил и напряжен постоя ток электрическ сопротивлен постоя ток и частот импульс электрическ напряжен поступа от измерительн преобразовател управля устройств друг источник сигнал и передач [UNK] сигнал из одн част измерительн кана дал ик ил управля кана дал ук в друг,
2018-71252-18," Устройства  сбора  и  передачи  данных  MILUR  IC  04  (далее  по  тексту  -  УСПД) предназначены для измерений электрической энергии, мощности, коммерческого и технического, многотарифного  учета  энергоресурсов,  сбора,  обработки,  хранения,  отображения  и  передачи полученной информации, в том числе и по каналам GSM/GPRS. ",устройство сбор и передача данных далее по текст успд предназначить для измерение электрический энергия мощность коммерческий и технический [UNK] учёт энергоресурсы сбор обработка хранение отображение и передача получить информация в тот число и по канал,устройств сбор и передач дан дал по текст успд предназнач для измерен электрическ энерг мощност коммерческ и техническ многотарифн учет энергоресурс сбор обработк хранен отображен и передач получен информац в том числ и по канал,
2018-71294-18, Спектрометры  оптико-эмиссионные  портативные  Q4  MOBILE  (далее - спектрометры) предназначены для измерения массовой доли элементов в металлах и сплавах в соответствии с аттестованными методами (методика) измерений (при использовании в сфере государственного регулирования обеспечения единства измерений). ,спектрометр [UNK] [UNK] [UNK] далее спектрометр предназначить для измерение массовый доля элемент в металл и сплав в соответствие с аттестованными метод методика измерение при использование в сфера государственный регулирование обеспечение [UNK] измерение,спектрометр [UNK] [UNK] портативн дал спектрометр предназнач для измерен массов дол элемент в металл и сплав в соответств с аттестова метод методик измерен при использован в сфер государствен регулирован обеспечен [UNK] измерен,
