file,text_cleaned,text_lemm,text_stem,field
2015-47643-15-2," типа системы описание Настоящее автоматизированной информационно-измерительной коммерческого  учета  электроэнергии  АИИС КУЭ  ОАО  «МЭК» г. Мытищи с Изменениями  № 1,  № 2,  № 3,  № 4  является  дополнением  к  описаниям  типа  системы автоматизированной  информационно-измерительной  коммерческого  учета  электроэнергии АИИС  КУЭ  ОАО RU.E.34.001.A  № 43682, RU.E.34.001.A RU.E.34.001.A № 58250  регистрационный № 47643-11,  № 47643-12,  № 47643-14,  № 47643-15 и  включает  в  себя  описание  дополнительных  измерительных  каналов,  соответствующих точкам измерений № 17, № 18. г.  Мытищи,  Свидетельства  об  утверждении № 48818, RU.E.34.001.A № 55629, ""МЭК"" типа                              Система  автоматизированная  информационно-измерительная  коммерческого  учета электроэнергии  АИИС  КУЭ    ОАО   «МЭК»  г.  Мытищи  с  Изменениями  № 1,  № 2,  № 3,  № 4 (далее   -    АИИС    КУЭ    ОАО  «МЭК») предназначена  для  измерения  активной  и  реактивной электроэнергии,  контроля  ее  передачи  и  потребления  отдельными  технологическими объектами, а также сбора, хранения и обработки полученной информации.  ",типа система описание настоящий автоматизировать информационно измерительный коммерческий учёт электроэнергия аиис куэ оао мэк г мытищи с изменение являться дополнение к описание тип система автоматизировать информационно измерительный коммерческий учёт электроэнергия аиис куэ оао [UNK] и включать в себя описание дополнительный измерительный канал соответствовать точка измерение г мытищи свидетельство об утверждение мэк тип система автоматизировать информационно измерительный коммерческий учёт электроэнергия аиис куэ оао мэк г мытищи с изменение далее аиис куэ оао мэк предназначить для измерение активный и реактивный электроэнергия контроль её передача и потребление отдельный технологический объект а также сбор хранение и обработка получить информация,тип систем описан настоя автоматизирова информацион измерительн коммерческ учет электроэнерг аиис куэ оа мэк г мытищ с изменен явля дополнен к описан тип систем автоматизирова информацион измерительн коммерческ учет электроэнерг аиис куэ оа [UNK] и включа в себ описан дополнительн измерительн канал соответств точк измерен г мытищ свидетельств об утвержден мэк тип систем автоматизирова информацион измерительн коммерческ учет электроэнерг аиис куэ оа мэк г мытищ с изменен дал аиис куэ оа мэк предназнач для измерен активн и реактивн электроэнерг контрол е передач и потреблен отдельн технологическ объект а такж сбор хранен и обработк получен информац,коммерческий учет электроэнергии 2
2015-48186-11, Датчики давления Метран-75 (далее -  датчики) предназначены для измерений избы-точного давления и абсолютного давления. Датчики обеспечивают непрерывное преобразо-вание измеряемого давления в аналоговый выходной сигнал постоянного тока и/или цифро-вой выходной сигнал в стандарте протокола HART. ,датчик давление [UNK] далее датчик предназначить для измерение [UNK] точный давление и абсолютный давление датчик обеспечивать непрерывный [UNK] [UNK] измеряемого давление в аналоговый выходной сигнал постоянный ток и или [UNK] [UNK] выходной сигнал в стандарт протокол,датчик давлен [UNK] дал датчик предназнач для измерен [UNK] точн давлен и абсолютн давлен датчик обеспечива непрерывн [UNK] ван измеря давлен в аналогов выходн сигна постоя ток и ил [UNK] во выходн сигна в стандарт протокол,
2015-59642-15, Расходомеры  электромагнитные  ЭЛТЕКО  ЭРМ  предназначены  для  измерений объемного расхода жидких электропроводящих сред. ,расходомер электромагнитный [UNK] [UNK] предназначить для измерение объёмный расход жидкий [UNK] среда,расходомер электромагнитн [UNK] [UNK] предназнач для измерен объемн расход жидк электропроводя сред,расходометры
2015-59668-15," Система  измерений  количества  и  показателей  качества  нефти  на  ПСП «Марковское»  ООО  «ИНК»  (далее -  СИКН)  предназначена  для  измерения  массы  брутто товарной  нефти  (далее –  нефти),  показателей  качества  нефти  и  определения  массы  нетто нефти  при  ведении  учетно-расчетных  операций  между  предприятием-поставщиком  ООО «Иркутская нефтяная компания» и предприятием-получателем ООО «Транснефть-Восток» ОАО «АК «Транснефть». ",система измерение количество и показатель качество нефть на псп [UNK] ооо [UNK] далее сикн предназначить для измерение масса брутто товарный нефть далее нефть показатель качество нефть и определение масса [UNK] нефть при ведение учетно расчётный операция между предприятие поставщик ооо иркутский нефтяной компания и предприятие [UNK] ооо транснефть восток оао [UNK] транснефть,систем измерен количеств и показател качеств нефт на псп [UNK] оо [UNK] дал сикн предназнач для измерен масс брутт товарн нефт дал нефт показател качеств нефт и определен масс [UNK] нефт при веден учетн расчетн операц межд предприят поставщик оо иркутск нефтян компан и предприят [UNK] оо транснефт восток оа [UNK] транснефт,качество и масса нефти
2015-59914-15, Датчики  линейных  перемещений DT  ( далее - датчики)  предназначены  для измерения линейных перемещений.  ,датчик линейный перемещение далее датчик предназначить для измерение линейный перемещение,датчик линейн перемещен дал датчик предназнач для измерен линейн перемещен,датчики линейных перемещений
2015-59956-15," Каналы  измерительные  системы  автоматического  управления  дизель-генераторными установками  (САУ  ДГ)  (далее  –каналы)  предназначены  для  преобразования  сигналов  от внешних (не входящих в состав каналов) первичных измерительных преобразователей в виде силы  постоянного  тока  унифицированного  диапазона,  импульсных  сигналов  и  сигналов  от термопреобразователей  сопротивления  с  визуализацией  результатов  преобразования  в  еди-ницах технологических параметров.  ",канал измерительный система автоматический управление [UNK] [UNK] установка [UNK] [UNK] далее канал предназначить для преобразование сигнал от внешний не входить в состав канал первичный измерительный преобразователь в вид сила постоянный ток унифицированный диапазон импульсный сигнал и сигнал от термопреобразователь сопротивление с визуализация результат преобразование в [UNK] [UNK] технологический параметр,канал измерительн систем автоматическ управлен [UNK] [UNK] установк са [UNK] дал канал предназнач для преобразован сигнал от внешн не входя в соста канал первичн измерительн преобразовател в вид сил постоя ток унифицирова диапазон импульсн сигнал и сигнал от термопреобразовател сопротивлен с визуализац результат преобразован в [UNK] [UNK] технологическ параметр,
2015-60312-15, Регистраторы  температуры  и  влажности  беспроводные Kaye RF ValProbe  (регистраторы)  предназначены  для  измерений  влажности  и  температуры  воздуха  в  месте хранения  продукции;  записи  результатов  измерений  во  внутреннюю  память  прибора  и преобразования измеренного значения в выходной линеаризованный сигнал для беспроводной передачи по радиоканалу. далее — ,[UNK] температура и влажность беспроводный [UNK] предназначить для измерение влажность и температура воздух в место хранение продукция [UNK] результат измерение во внутренний память прибор и преобразование измеренного значение в выходной [UNK] сигнал для беспроводный передача по [UNK] далее,[UNK] температур и влажност беспроводн [UNK] предназнач для измерен влажност и температур воздух в мест хранен продукц [UNK] результат измерен во внутрен [UNK] прибор и преобразован измерен значен в выходн [UNK] сигна для беспроводн передач по радиоканал дал,
2015-60390-15," Система  измерений  количества  и  параметров  природного  газа  в  составе  узла коммерческого  учета  газа  «Обустройство  Ачимовских  отложений  Уренгойского месторождения Самбургского лицензионного участка на период ОПЭ» (далее –  система) предназначена для измерения в автоматизированном режиме объема и объемного расхода газа,  приведенных  к  стандартным  условиям;  определения  показателей  качества  газа, формирования отчетных документов по количеству и качеству газа. ",система измерение количество и параметр природный газ в состав узел коммерческий учёт газ [UNK] [UNK] [UNK] [UNK] месторождение [UNK] [UNK] участок на период [UNK] далее система предназначить для измерение в автоматизированный режим объём и объёмный расход газ привести к стандартный условие определение показатель качество газ формирование отчетных документ по количество и качество газ,систем измерен количеств и параметр природн газ в состав узл коммерческ учет газ [UNK] [UNK] [UNK] [UNK] месторожден [UNK] [UNK] участк на период [UNK] дал систем предназнач для измерен в автоматизирова режим объем и объемн расход газ приведен к стандартн услов определен показател качеств газ формирован отчетн документ по количеств и качеств газ,
2015-60397-15, Преобразователь  термоэлектрический  с  двумя  термопарами  модели 1136-11-167  ( далее по тексту –  термопреобразователь или ТП) предназначен для измерения температуры на ОАО «Мосэнерго» филиал ТЭЦ-20.  ,преобразователь термоэлектрический с два [UNK] модель далее по текст термопреобразователь или тп предназначить для измерение температура на оао мосэнерго филиал тэц,преобразовател термоэлектрическ с [UNK] термопар модел дал по текст термопреобразовател ил тп предназнач для измерен температур на оа мосэнерг филиа тэц,термопреобразователи
2015-60444-15," Система  автоматизированная  информационно-измерительная  коммерческого  учета электроэнергии  АИИС  КУЭ  ЕНЭС  ПС 220  кВ  «Северный  Возей»  (далее  по  тексту –  АИИС КУЭ) предназначена для измерения активной и реактивной электроэнергии, сбора, обработки, хранения и передачи полученной информации. Полученные  данные  и  результаты  измерений  могут  использоваться  для  оперативного управления энергопотреблением на ПС 220 кВ «Северный Возей» ОАО «ФСК ЕЭС». ",система автоматизировать информационно измерительный коммерческий учёт электроэнергия аиис куэ енэс пс кв северный [UNK] далее по текст аиис куэ предназначить для измерение активный и реактивный электроэнергия сбор обработка хранение и передача получить информация получить данные и результат измерение мочь использоваться для оперативный управление энергопотребление на пс кв северный [UNK] оао фск еэс,систем автоматизирова информацион измерительн коммерческ учет электроэнерг аиис куэ енэс пс кв северн [UNK] дал по текст аиис куэ предназнач для измерен активн и реактивн электроэнерг сбор обработк хранен и передач получен информац получен дан и результат измерен могут использова для оперативн управлен энергопотреблен на пс кв северн [UNK] оа фск еэс,коммерческий учет электроэнергии 2
2015-60509-15," Система  автоматизированная  информационно-измерительная  коммерческого  учета электроэнергии (АИИС КУЭ) ТРК «Щука» (далее – АИИС КУЭ) предназначена для измерения активной  и  реактивной  электроэнергии,  а  также  для  автоматизированного  сбора,  обработки, хранения  и  передачи  полученной  информации  заинтересованным  организациям  в  рамках согласованного регламента. ",система автоматизировать информационно измерительный коммерческий учёт электроэнергия аиис куэ трк [UNK] далее аиис куэ предназначить для измерение активный и реактивный электроэнергия а также для автоматизированный сбор обработка хранение и передача получить информация заинтересованный организация в рамка согласованного регламент,систем автоматизирова информацион измерительн коммерческ учет электроэнерг аиис куэ трк [UNK] дал аиис куэ предназнач для измерен активн и реактивн электроэнерг а такж для автоматизирова сбор обработк хранен и передач получен информац заинтересова организац в рамк согласова регламент,коммерческий учет электроэнергии 2
2015-60518-15," Делитель  напряжения Ross VD60-0-BD-LD-ALF  ( далее –  делитель)  предназначен  для масштабного  преобразования  значения  высокого  напряжения  постоянного  тока  в  низкое напряжение  постоянного  тока,  пригодное  для  измерения  с  помощью  выпускаемых промышленностью  средств  измерений,  и  применяемых  в  составе  измерительных  систем  для контроля  испытательного  напряжения  постоянного  тока,  а  также  для  масштабного преобразования импульсного и переменного напряжения. ",[UNK] напряжение далее [UNK] предназначить для масштабный преобразование значение высокий напряжение постоянный ток в [UNK] напряжение постоянный ток [UNK] для измерение с помощь [UNK] промышленность средство измерение и [UNK] в состав измерительный система для контроль испытательный напряжение постоянный ток а также для масштабный преобразование импульсный и переменный напряжение,делител напряжен дал делител предназнач для масштабн преобразован значен высок напряжен постоя ток в [UNK] напряжен постоя ток [UNK] для измерен с помощ [UNK] промышлен средств измерен и применя в состав измерительн сист для контрол испытательн напряжен постоя ток а такж для масштабн преобразован импульсн и перемен напряжен,напряжение тока
2015-60530-15," Система  автоматизированная  информационно-измерительная  коммерческого  учета электроэнергии  АИИС  КУЭ  ЕНЭС  ПС 330  кВ  «Мончегорск»  (далее  по  тексту –  АИИС  КУЭ) предназначена  для  измерения  активной  и  реактивной  электроэнергии,  сбора,  обработки, хранения и передачи полученной информации. Полученные  данные  и  результаты  измерений  могут  использоваться  для  оперативного управления энергопотреблением на ПС 330 кВ «Мончегорск» ОАО «ФСК ЕЭС». ",система автоматизировать информационно измерительный коммерческий учёт электроэнергия аиис куэ енэс пс кв [UNK] далее по текст аиис куэ предназначить для измерение активный и реактивный электроэнергия сбор обработка хранение и передача получить информация получить данные и результат измерение мочь использоваться для оперативный управление энергопотребление на пс кв [UNK] оао фск еэс,систем автоматизирова информацион измерительн коммерческ учет электроэнерг аиис куэ енэс пс кв [UNK] дал по текст аиис куэ предназнач для измерен активн и реактивн электроэнерг сбор обработк хранен и передач получен информац получен дан и результат измерен могут использова для оперативн управлен энергопотреблен на пс кв [UNK] оа фск еэс,коммерческий учет электроэнергии 2
